runs/run_20260421T091510556541Z/indexes/bm25/bm25_stats.json

{
  "avg_doc_length": 88.14285714285714,
  "b": 0.75,
  "backend": "bm25_okapi_v1",
  "doc_lengths": {
    "chunk:chunk_001": 35,
    "chunk:chunk_002": 97,
    "chunk:chunk_003": 69,
    "chunk:chunk_004": 130,
    "chunk:chunk_005": 49,
    "chunk:chunk_006": 59,
    "chunk:chunk_007": 100,
    "chunk:chunk_008": 31,
    "chunk:chunk_009": 139,
    "chunk:chunk_010": 74,
    "chunk:chunk_011": 101,
    "chunk:chunk_012": 22,
    "chunk:chunk_013": 65,
    "chunk:chunk_014": 25,
    "chunk:chunk_015": 33,
    "chunk:chunk_016": 17,
    "chunk:chunk_017": 28,
    "chunk:chunk_018": 32,
    "chunk:chunk_019": 22,
    "chunk:chunk_020": 49,
    "chunk:chunk_021": 30,
    "chunk:chunk_022": 21,
    "chunk:chunk_023": 58,
    "chunk:chunk_024": 91,
    "chunk:chunk_025": 33,
    "chunk:chunk_026": 51,
    "chunk:chunk_027": 73,
    "chunk:chunk_028": 32,
    "chunk:chunk_029": 15,
    "chunk:chunk_030": 99,
    "chunk:chunk_031": 21,
    "chunk:chunk_032": 23,
    "chunk:chunk_033": 27,
    "chunk:chunk_034": 34,
    "chunk:chunk_035": 41,
    "figure:figure_001": 198,
    "figure:figure_002": 241,
    "figure:figure_003": 219,
    "figure:figure_004": 244,
    "figure:figure_005": 246,
    "figure:figure_006": 155,
    "figure:figure_007": 208,
    "figure:figure_008": 209,
    "figure:figure_009": 163,
    "section:section_001": 143,
    "section:section_002": 192,
    "section:section_003": 193,
    "section:section_004": 42,
    "section:section_005": 75,
    "section:section_006": 37,
    "section:section_007": 52,
    "section:section_008": 220,
    "section:section_009": 101,
    "section:section_010": 21,
    "section:section_011": 125,
    "table:table_001": 26
  },
  "idf": {
    "0.002.": 3.126760535960395,
    "0.003": 3.126760535960395,
    "0.05": 3.126760535960395,
    "0.3333": 3.126760535960395,
    "0.5": 3.126760535960395,
    "1": 2.338303175596125,
    "1.": 1.791759469228055,
    "1.1": 2.338303175596125,
    "1.13": 2.338303175596125,
    "1.6mm": 2.538973871058276,
    "1.6mm.": 3.6375861597263857,
    "11.66": 3.126760535960395,
    "11.662mm": 3.126760535960395,
    "1970s.": 3.126760535960395,
    "1980s": 3.126760535960395,
    "1983": 2.538973871058276,
    "1989": 2.538973871058276,
    "1995": 2.028148247292285,
    "2": 2.338303175596125,
    "2%": 1.9029851043382795,
    "2.": 3.126760535960395,
    "2.25": 2.171249090932959,
    "2.25ghz": 1.791759469228055,
    "2.4": 3.126760535960395,
    "2.5": 2.338303175596125,
    "2.5ghz": 2.171249090932959,
    "20.286mm": 3.126760535960395,
    "20.29": 3.126760535960395,
    "2001": 2.028148247292285,
    "2005": 1.5173226235262949,
    "23": 2.338303175596125,
    "2ghz": 1.6916760106710724,
    "2th": 3.126760535960395,
    "3": 2.538973871058276,
    "3.": 3.126760535960395,
    "31.43": 3.126760535960395,
    "31mm": 3.126760535960395,
    "3d": 2.338303175596125,
    "4": 2.790288299339182,
    "4.": 2.171249090932959,
    "4.4": 2.171249090932959,
    "40.1": 3.126760535960395,
    "40.57": 3.126760535960395,
    "41.19": 3.126760535960395,
    "41.19mm.": 3.126760535960395,
    "46mhz.": 2.028148247292285,
    "47.98": 3.126760535960395,
    "5.": 2.171249090932959,
    "50": 2.538973871058276,
    "50.32": 3.126760535960395,
    "50.32mm": 3.126760535960395,
    "50_": 3.126760535960395,
    "6": 2.790288299339182,
    "6.": 2.538973871058276,
    "649-653": 3.126760535960395,
    "7": 2.028148247292285,
    "7.": 3.126760535960395,
    "8": 2.338303175596125,
    "8.": 3.126760535960395,
    "9.": 2.790288299339182,
    "9.61%": 2.338303175596125,
    "90.84%": 2.338303175596125,
    "a": 0.5930637220029628,
    "a.": 2.338303175596125,
    "able": 3.126760535960395,
    "abstract": 3.126760535960395,
    "acknowledgement": 3.126760535960395,
    "active": 3.126760535960395,
    "actual": 3.126760535960395,
    "advances": 3.126760535960395,
    "advantages": 3.126760535960395,
    "after": 2.538973871058276,
    "agartala": 3.126760535960395,
    "al": 1.6916760106710724,
    "alak": 3.126760535960395,
    "all": 3.126760535960395,
    "along": 3.126760535960395,
    "also": 2.338303175596125,
    "ammnan": 2.538973871058276,
    "an": 2.538973871058276,
    "analysis": 2.790288299339182,
    "and": 0.4457390072461043,
    "another": 3.126760535960395,
    "ant": 3.6375861597263857,
    "antenna": 0.3667505959274739,
    "antenna.": 2.028148247292285,
    "antennas": 1.6916760106710724,
    "antennas.": 3.126760535960395,
    "any": 3.126760535960395,
    "ap-31": 3.126760535960395,
    "aperture": 3.126760535960395,
    "applications": 2.538973871058276,
    "appropriately.": 3.126760535960395,
    "approximately": 1.5173226235262949,
    "are": 1.6916760106710724,
    "around": 3.126760535960395,
    "arrays": 2.538973871058276,
    "artech": 3.126760535960395,
    "as": 0.7659065348423736,
    "at": 0.9749983327009332,
    "author": 3.126760535960395,
    "average": 2.338303175596125,
    "b": 3.126760535960395,
    "b.": 3.126760535960395,
    "back": 2.338303175596125,
    "backbone": 3.126760535960395,
    "balanis": 1.791759469228055,
    "band": 2.538973871058276,
    "band.": 2.538973871058276,
    "bandwidth": 1.6916760106710724,
    "based": 3.126760535960395,
    "basic": 3.126760535960395,
    "be": 0.7288652631620246,
    "because": 1.9029851043382795,
    "been": 1.791759469228055,
    "began": 3.126760535960395,
    "behind": 3.126760535960395,
    "below.": 2.028148247292285,
    "better": 3.126760535960395,
    "between": 1.9029851043382795,
    "but": 3.126760535960395,
    "by": 1.0726368022648491,
    "c.": 3.126760535960395,
    "c.a.": 3.126760535960395,
    "cable": 1.9029851043382795,
    "cable.": 2.338303175596125,
    "calculated": 3.126760535960395,
    "can": 1.0226263816901875,
    "categories-": 3.126760535960395,
    "center": 1.5173226235262949,
    "characteristics": 2.790288299339182,
    "characterized": 3.126760535960395,
    "chart": 2.338303175596125,
    "choice": 3.126760535960395,
    "chpp.": 3.126760535960395,
    "circular": 3.126760535960395,
    "classified": 3.126760535960395,
    "classify": 3.126760535960395,
    "clear": 2.338303175596125,
    "clearly": 2.338303175596125,
    "close": 3.126760535960395,
    "co-polarization": 2.338303175596125,
    "coaxial": 1.6007042324653458,
    "colors": 2.338303175596125,
    "communication": 2.171249090932959,
    "communications.": 3.126760535960395,
    "components.": 2.338303175596125,
    "conclusion": 2.790288299339182,
    "conducting": 2.790288299339182,
    "conformability": 3.126760535960395,
    "connecting": 3.126760535960395,
    "considerations": 3.126760535960395,
    "considers": 2.338303175596125,
    "consists": 3.126760535960395,
    "constant": 1.791759469228055,
    "constant.": 2.538973871058276,
    "contacting": 2.538973871058276,
    "conventional": 3.126760535960395,
    "copper": 2.790288299339182,
    "cost": 3.126760535960395,
    "coupling": 3.126760535960395,
    "covering": 2.790288299339182,
    "cross-polarization": 2.338303175596125,
    "current": 1.9029851043382795,
    "d.h": 3.126760535960395,
    "d.m.": 3.126760535960395,
    "db": 2.171249090932959,
    "decades": 3.126760535960395,
    "density": 2.028148247292285,
    "department": 3.126760535960395,
    "design": 0.7288652631620246,
    "designed": 2.538973871058276,
    "desire": 2.538973871058276,
    "desired": 2.028148247292285,
    "determined": 3.126760535960395,
    "development": 3.126760535960395,
    "device": 3.126760535960395,
    "dielectric": 1.3022112439093492,
    "different": 2.338303175596125,
    "dimension": 2.538973871058276,
    "dimensions": 2.171249090932959,
    "dipole": 3.126760535960395,
    "directly": 3.126760535960395,
    "distance": 3.126760535960395,
    "distribution": 2.171249090932959,
    "done": 3.126760535960395,
    "double": 3.6375861597263857,
    "dr.": 2.538973871058276,
    "driving": 3.126760535960395,
    "dublin": 3.126760535960395,
    "due": 2.538973871058276,
    "e-plane": 2.171249090932959,
    "each": 2.538973871058276,
    "early": 3.126760535960395,
    "ease": 3.126760535960395,
    "easily": 3.126760535960395,
    "ece": 3.126760535960395,
    "edge": 3.6375861597263857,
    "edition": 3.126760535960395,
    "effect": 3.126760535960395,
    "effective": 2.338303175596125,
    "efficiency": 3.126760535960395,
    "electromagnetic": 3.126760535960395,
    "element": 3.126760535960395,
    "elements": 3.126760535960395,
    "empirically": 3.126760535960395,
    "employed": 3.6375861597263857,
    "end": 3.126760535960395,
    "epoxy": 2.538973871058276,
    "equal": 3.126760535960395,
    "equals": 2.338303175596125,
    "essential": 2.538973871058276,
    "establish": 3.126760535960395,
    "et": 1.6916760106710724,
    "etce": 3.126760535960395,
    "etched": 2.790288299339182,
    "exemplified": 3.126760535960395,
    "exhibits": 3.126760535960395,
    "expected": 2.538973871058276,
    "extended": 3.126760535960395,
    "extensively": 3.126760535960395,
    "f": 3.126760535960395,
    "f0": 3.126760535960395,
    "fabricated": 3.126760535960395,
    "factor": 3.126760535960395,
    "fairly": 3.126760535960395,
    "fed": 2.171249090932959,
    "feed": 1.5173226235262949,
    "feed.": 3.126760535960395,
    "feeding": 1.791759469228055,
    "fiber": 3.6375861597263857,
    "field": 2.028148247292285,
    "fields": 2.171249090932959,
    "fig.": 1.3689026184080213,
    "figure": 0.9749983327009332,
    "figures/figure_001.png": 3.6375861597263857,
    "figures/figure_002.png": 3.6375861597263857,
    "figures/figure_003.png": 3.6375861597263857,
    "figures/figure_004.png": 3.6375861597263857,
    "figures/figure_005.png": 3.6375861597263857,
    "figures/figure_006.png": 3.6375861597263857,
    "figures/figure_007.png": 3.6375861597263857,
    "figures/figure_008.png": 3.6375861597263857,
    "figures/figure_009.png": 3.6375861597263857,
    "final": 2.338303175596125,
    "finite": 2.538973871058276,
    "firstly": 3.126760535960395,
    "flame": 2.790288299339182,
    "folded": 3.126760535960395,
    "for": 1.0226263816901875,
    "force": 3.126760535960395,
    "fr": 3.6375861597263857,
    "fr-4": 2.028148247292285,
    "fr4": 3.126760535960395,
    "free-space": 3.126760535960395,
    "frequencie": 3.6375861597263857,
    "frequencies": 2.538973871058276,
    "frequencies.": 3.6375861597263857,
    "frequency": 1.2396908869280152,
    "frequency.": 2.028148247292285,
    "fringing": 2.538973871058276,
    "from": 1.4403615823901663,
    "g": 2.538973871058276,
    "generally": 2.790288299339182,
    "geometrical": 3.126760535960395,
    "geometry": 3.6375861597263857,
    "ghz": 1.4403615823901663,
    "ghz.": 3.126760535960395,
    "given": 2.338303175596125,
    "gives": 2.028148247292285,
    "gmail.com": 3.126760535960395,
    "gold.": 2.790288299339182,
    "good": 1.791759469228055,
    "greater": 3.126760535960395,
    "ground": 1.5173226235262949,
    "h": 2.338303175596125,
    "h-plane": 2.171249090932959,
    "hall": 3.126760535960395,
    "handbook": 2.790288299339182,
    "has": 1.2396908869280152,
    "have": 1.4403615823901663,
    "having": 3.126760535960395,
    "height": 2.338303175596125,
    "hence": 2.790288299339182,
    "high": 2.338303175596125,
    "higher": 2.790288299339182,
    "his": 3.126760535960395,
    "house.": 3.126760535960395,
    "how": 2.338303175596125,
    "huang": 2.538973871058276,
    "i": 3.6375861597263857,
    "i.": 2.538973871058276,
    "ieee": 2.790288299339182,
    "if": 3.126760535960395,
    "ii.": 3.6375861597263857,
    "iii.": 2.790288299339182,
    "impedance": 1.3689026184080213,
    "impedance.": 2.338303175596125,
    "implies": 1.6916760106710724,
    "important": 2.338303175596125,
    "in": 0.5315058290035294,
    "include": 2.790288299339182,
    "includes": 3.126760535960395,
    "increases": 2.790288299339182,
    "independent": 3.126760535960395,
    "inder": 3.126760535960395,
    "india": 3.126760535960395,
    "indicates": 2.171249090932959,
    "input": 1.5173226235262949,
    "inside": 3.126760535960395,
    "institute": 3.126760535960395,
    "integration": 3.126760535960395,
    "interscience": 3.126760535960395,
    "into": 2.028148247292285,
    "introduction": 3.126760535960395,
    "is": 0.3667505959274739,
    "it": 1.3022112439093492,
    "its": 2.028148247292285,
    "ittipiboon": 3.126760535960395,
    "iv.": 3.126760535960395,
    "j.": 2.790288299339182,
    "james": 2.538973871058276,
    "jirania": 3.126760535960395,
    "john": 3.126760535960395,
    "joydeb": 3.126760535960395,
    "joysetce": 3.126760535960395,
    "keywords": 3.126760535960395,
    "l": 1.9029851043382795,
    "largely": 3.126760535960395,
    "larger": 3.126760535960395,
    "last": 3.126760535960395,
    "lastly": 3.126760535960395,
    "late": 3.126760535960395,
    "length": 2.028148247292285,
    "level": 2.338303175596125,
    "light": 3.126760535960395,
    "like": 2.790288299339182,
    "line": 2.538973871058276,
    "linearly": 2.338303175596125,
    "lines": 2.790288299339182,
    "located": 3.126760535960395,
    "location": 2.538973871058276,
    "london": 3.126760535960395,
    "loss": 1.5173226235262949,
    "low": 2.028148247292285,
    "lower": 3.126760535960395,
    "made": 2.790288299339182,
    "majumder": 3.126760535960395,
    "make": 3.126760535960395,
    "many": 2.171249090932959,
    "match": 2.538973871058276,
    "matched": 2.338303175596125,
    "matched.": 2.790288299339182,
    "matching": 3.126760535960395,
    "material": 2.028148247292285,
    "max": 2.538973871058276,
    "measure": 2.338303175596125,
    "method": 2.538973871058276,
    "methods": 3.126760535960395,
    "methods.": 3.126760535960395,
    "microstrip": 1.0226263816901875,
    "microwave": 3.126760535960395,
    "milligan": 3.126760535960395,
    "mismatched": 2.338303175596125,
    "mm": 2.538973871058276,
    "modeling.": 3.126760535960395,
    "modern": 3.126760535960395,
    "moreover": 1.6916760106710724,
    "mr.": 3.126760535960395,
    "much": 2.338303175596125,
    "must": 3.126760535960395,
    "nature": 2.338303175596125,
    "neglected": 3.126760535960395,
    "new": 2.790288299339182,
    "nit": 3.126760535960395,
    "no.": 3.126760535960395,
    "non-contacting": 3.126760535960395,
    "non-contacting.": 3.126760535960395,
    "not": 2.338303175596125,
    "now": 3.126760535960395,
    "number": 3.126760535960395,
    "o": 3.126760535960395,
    "observed": 2.338303175596125,
    "obtai": 3.6375861597263857,
    "obtained": 1.2396908869280152,
    "obtained.": 3.126760535960395,
    "of": 0.22533894187764542,
    "ohms": 3.126760535960395,
    "on": 0.9749983327009332,
    "one": 2.538973871058276,
    "ope": 3.6375861597263857,
    "operate": 2.028148247292285,
    "operating": 2.538973871058276,
    "or": 1.6916760106710724,
    "order": 3.126760535960395,
    "other": 2.538973871058276,
    "over": 3.126760535960395,
    "own": 3.126760535960395,
    "p.": 3.126760535960395,
    "paper": 2.028148247292285,
    "parabolic": 3.126760535960395,
    "parameter": 2.338303175596125,
    "parameter.": 2.790288299339182,
    "parameters": 1.9029851043382795,
    "partial": 3.126760535960395,
    "patch": 0.39239302654081165,
    "patch.": 3.126760535960395,
    "patches": 3.126760535960395,
    "pattern": 1.6916760106710724,
    "peregrinus": 3.126760535960395,
    "perfect": 3.126760535960395,
    "perfectly": 2.338303175596125,
    "performance": 2.790288299339182,
    "periphery": 2.790288299339182,
    "periphery.": 3.126760535960395,
    "permittivity": 3.126760535960395,
    "peter": 3.126760535960395,
    "photo": 2.790288299339182,
    "physical": 2.538973871058276,
    "picture": 2.338303175596125,
    "placed": 3.126760535960395,
    "plane": 1.9029851043382795,
    "plane.": 2.790288299339182,
    "plate": 3.126760535960395,
    "play": 3.126760535960395,
    "plot": 2.338303175596125,
    "polarization": 2.338303175596125,
    "polarized.": 2.338303175596125,
    "port": 2.538973871058276,
    "position": 3.126760535960395,
    "power": 1.9029851043382795,
    "power.": 2.790288299339182,
    "pozar": 2.028148247292285,
    "pp.": 3.126760535960395,
    "practical": 3.126760535960395,
    "prakash": 3.126760535960395,
    "pre": 3.6375861597263857,
    "presented": 2.338303175596125,
    "presents": 3.126760535960395,
    "press": 2.790288299339182,
    "primarily": 3.6375861597263857,
    "printed": 3.126760535960395,
    "probe": 2.028148247292285,
    "produces": 2.790288299339182,
    "propagate": 3.126760535960395,
    "propagating": 2.338303175596125,
    "proper": 3.6375861597263857,
    "properly": 2.790288299339182,
    "properties": 3.126760535960395,
    "proposed": 2.338303175596125,
    "prototype": 3.126760535960395,
    "proximity": 3.126760535960395,
    "q.": 3.126760535960395,
    "quality": 3.126760535960395,
    "r": 3.126760535960395,
    "r.": 3.126760535960395,
    "radiate": 3.126760535960395,
    "radiated": 2.790288299339182,
    "radiating": 2.338303175596125,
    "radiation": 1.6916760106710724,
    "radiation.": 3.126760535960395,
    "ramesh": 2.028148247292285,
    "range": 1.791759469228055,
    "range.": 2.538973871058276,
    "rapid": 3.126760535960395,
    "re": 3.126760535960395,
    "recent": 3.126760535960395,
    "rectangular": 1.2396908869280152,
    "reduced": 3.126760535960395,
    "reduction": 3.126760535960395,
    "references": 3.126760535960395,
    "reff": 3.126760535960395,
    "reflected": 2.171249090932959,
    "reflectors": 3.126760535960395,
    "regard.": 3.126760535960395,
    "reinforced": 3.6375861597263857,
    "relationship": 2.338303175596125,
    "relative": 3.126760535960395,
    "requirement": 2.790288299339182,
    "resonant": 2.538973871058276,
    "result": 2.338303175596125,
    "results": 2.790288299339182,
    "retardant": 2.790288299339182,
    "return": 1.791759469228055,
    "rf": 3.126760535960395,
    "role": 3.126760535960395,
    "s-band": 2.790288299339182,
    "s.": 3.126760535960395,
    "s11": 2.338303175596125,
    "satellite": 3.126760535960395,
    "scattering": 2.338303175596125,
    "schaubert": 3.126760535960395,
    "scheme": 2.538973871058276,
    "secondly": 3.126760535960395,
    "selected": 2.338303175596125,
    "sh": 3.126760535960395,
    "shapes": 3.126760535960395,
    "shown": 1.125280535750271,
    "shows": 2.028148247292285,
    "side": 2.538973871058276,
    "sided": 3.6375861597263857,
    "signifies": 2.338303175596125,
    "simple": 3.126760535960395,
    "simulated": 2.538973871058276,
    "simulation": 1.9029851043382795,
    "simulation.": 2.790288299339182,
    "simulations": 2.790288299339182,
    "singha": 3.126760535960395,
    "six": 3.126760535960395,
    "size": 1.9029851043382795,
    "slot": 3.126760535960395,
    "small": 2.538973871058276,
    "smith": 2.338303175596125,
    "so": 3.126760535960395,
    "some": 3.126760535960395,
    "sons": 3.126760535960395,
    "span.": 3.126760535960395,
    "spectrum.": 2.790288299339182,
    "spurious": 3.126760535960395,
    "stable": 2.028148247292285,
    "standard": 3.126760535960395,
    "structure": 3.6375861597263857,
    "studied": 3.126760535960395,
    "substrate": 1.2396908869280152,
    "such": 1.791759469228055,
    "support": 3.126760535960395,
    "surface": 2.338303175596125,
    "systems": 3.126760535960395,
    "systems.": 2.538973871058276,
    "t": 3.126760535960395,
    "table": 3.126760535960395,
    "tangent": 2.790288299339182,
    "technique": 2.538973871058276,
    "technology": 2.538973871058276,
    "technology.": 3.126760535960395,
    "term": 3.126760535960395,
    "th": 3.6375861597263857,
    "than": 2.538973871058276,
    "thank": 3.126760535960395,
    "that": 1.0726368022648491,
    "the": 0.06336961393258919,
    "their": 2.790288299339182,
    "them": 3.126760535960395,
    "theory": 3.126760535960395,
    "there": 2.538973871058276,
    "therefore": 3.6375861597263857,
    "these": 3.126760535960395,
    "they": 3.126760535960395,
    "thick": 3.6375861597263857,
    "thickness": 1.9029851043382795,
    "thickness.": 3.126760535960395,
    "thin": 3.126760535960395,
    "this": 0.5930637220029628,
    "thomas": 2.538973871058276,
    "three": 3.126760535960395,
    "thro": 3.6375861597263857,
    "through": 2.338303175596125,
    "throughout": 2.338303175596125,
    "thus": 1.6916760106710724,
    "times": 3.126760535960395,
    "to": 0.5020919437972361,
    "trans.": 3.126760535960395,
    "transfer": 3.126760535960395,
    "transferred": 2.338303175596125,
    "transmission": 3.126760535960395,
    "transmitted.": 2.338303175596125,
    "tripura": 3.126760535960395,
    "two": 3.126760535960395,
    "type": 2.538973871058276,
    "types": 3.126760535960395,
    "uk.": 3.126760535960395,
    "undesired": 2.338303175596125,
    "usa": 3.126760535960395,
    "usage.": 3.126760535960395,
    "used": 1.6916760106710724,
    "using": 1.9029851043382795,
    "usually": 2.338303175596125,
    "v.": 2.790288299339182,
    "value": 2.028148247292285,
    "variety": 3.126760535960395,
    "various": 3.126760535960395,
    "versus": 3.126760535960395,
    "very": 1.6916760106710724,
    "vi.": 2.790288299339182,
    "vii.": 3.126760535960395,
    "vol.": 3.126760535960395,
    "vs": 3.126760535960395,
    "vswr": 1.791759469228055,
    "w": 2.538973871058276,
    "was": 2.171249090932959,
    "wavelength.": 3.126760535960395,
    "way": 3.126760535960395,
    "we": 2.790288299339182,
    "weightiness": 3.126760535960395,
    "well": 2.028148247292285,
    "were": 3.126760535960395,
    "west": 3.126760535960395,
    "where": 2.538973871058276,
    "which": 1.125280535750271,
    "whole": 2.338303175596125,
    "width": 1.9029851043382795,
    "wiley": 3.126760535960395,
    "wireless": 3.126760535960395,
    "with": 1.4403615823901663,
    "within": 2.171249090932959,
    "work.": 3.126760535960395,
    "would": 1.791759469228055,
    "x": 2.538973871058276,
    "xf": 3.126760535960395,
    "y": 3.126760535960395,
    "york": 2.790288299339182,
    "zin": 3.126760535960395
  },
  "k1": 1.5
}

runs/run_20260421T091510556541Z/bundle/fulltext.md

## I. INTRODUCTION

Microstrip antennas are characterized by a larger number of physical parameters than conventional microwave antennas. They can be designed to have many geometrical shapes and dimensions but rectangular and circular Microstrip resonant patches have been used extensively in many applications (Ramesh et al, 2001). In this paper, the design of probe feed rectangular microstrip antenna is for satellite applications is presented and is expected to operate within 2GHz - 2.25GHz frequency span. This antenna is designed on a double sided Fiber Reinforced (FR-4) epoxy and its performance characteristics which include Return Loss, VSWR, and input impedance are obtained from the simulation.

patch is usually 0.3333 _o< L < 0.5 _o, where _o is the free-space wavelength. The patch is selected to be very thin such that t << _o (where t is the patch thickness). The height h of the dielectric is usually 0.003 _o <= h <= 0.05 _o (Balanis, 2005). Thus, a rectangular patch of dimension 40.1 mm×31mm is designed on one side of an FR4 substrate of thickness 1.6mm and relative permittivity 4.4 and the ground plane is located on the other side of the substrate with dimension 50.32mm x 41.19mm. The antenna plate is fed by standard coaxial of 50_ at feeding location of 11.662mm by 20.286mm on the patch. This type of feeding scheme can be placed at any desired location inside the patch in order to match with the desire input impedance and has low spurious radiation.

## III. DESIGN REQUIREMENT

There are three essential parameters for design of a coaxial feed rectangular microstrip Patch Antenna. Firstly, the resonant frequency ( f0 ) of the antenna must be selected appropriately. The frequency range used is from 2GHz 2.5GHz and the design antenna must be able to operate within this frequency range. The resonant frequency selected for this design is 2.25GHz with band width of 46MHz.

## V. SIMULATIONS AND RESULTS

The return loss of the antenna obtained is -23 dB at the center frequency of 2.25 GHz as shown in Fig. 4. This indicates that 9.61% of power is reflected and 90.84% of power is transmitted. Thus, the bandwidth obtained from the return loss result is 2% which signifies 46MHz.

Moreover, VSWR is a measure of how well matched antenna is to the cable impedance. A perfectly matched antenna would have a VSWR of 1:1. This indicates how much power is reflected back or transferred into a cable. VSWR obtained from the simulation is 1.13 dB which is approximately equals to 1.1:1 as shown in Fig. 5. This considers a good value as the level of mismatched is not very high because high VSWR implies that the port is not properly matched.

Fig. 6 shows that the input impedance of the antenna at the center frequency 2.25 GHz is 47.98 Ω; this is very close to the expected 50 Ω .

Also, the radiation pattern of the antenna is obtained as Fig. 7 shows the E-plane and H-plane pattern at 2.25GHz center frequency. It can be observed from this radiation that the design antenna has stable radiation pattern throughout the whole operating band.